{
  "id": "SUP-9001",
  "schemaVersion": "0.1.0",
  "recordVersion": "0.1.0",
  "revision": 0,
  "status": "Draft",
  "createdAt": "2026-01-01T00:00:00Z",
  "createdBy": "test-suite",
  "updatedAt": "2026-01-01T00:00:00Z",
  "updatedBy": "test-suite",
  "sourceLinks": [],
  "changeSummary": "Výhradne fiktívny Supplier testovací záznam.",
  "name": "Fiktívna organizácia Alfa",
  "notes": "Fiktívny test bez reálnej organizácie."
}
