{"id":"MAT-9016","schemaVersion":"0.1.0","recordVersion":"0.1.0","revision":0,"status":"Review","createdAt":"2026-01-01T00:00:00Z","createdBy":"test-suite","updatedAt":"2026-01-01T00:00:00Z","updatedBy":"test-suite","sourceLinks":[{"sourceReferenceId":"SRC-980001","sourceClass":"N","supportedClaim":"Fictional Material identity used only for validation.","usageType":"citation","verificationStatus":"Reviewed"}],"changeSummary":"Fictional Material validation fixture.","name":"Example Material Pi"}
